{
    "$schema": "http://json-schema.org/draft-07/schema#",
    "title": "Generated schema for Root",
    "type": "array",
    "items": {
      "type": "object",
      "properties": {
        "set_num": {
          "type": "number"
        },
        "min_weight_multiplier": {
          "type": "number"
        },
        "max_weight_multiplier": {
          "type": "number"
        },
        "reps": {
          "type": "string"
        },
        "description": {
          "type": "string"
        }
      },
      "required": [
        "set_num",
        "min_weight_multiplier",
        "max_weight_multiplier",
        "reps",
        "description"
      ]
    }
  }
  